{
  "router_version": "1.0.0",
  "router_id": "ALMAS_PERSONAL_REFERENCE_ROUTER_V1",
  "source_registry_contract": "reference/source-registry.json",
  "principles": {
    "source_presence_is_not_weight": true,
    "source_gap_must_remain_explicit": true,
    "doctrine_and_method_must_remain_distinguishable": true
  },
  "domains": {
    "foundations": {
      "status": "SUPPORTED",
      "epistemic_scope": [
        "B_TECHNIQUE"
      ],
      "source_ids": [
        "astrodienst_zodiac_sign",
        "astrodienst_element",
        "astrodienst_quality",
        "astrodienst_intro_houses",
        "astrodienst_main_axis",
        "astrodienst_personal_planet",
        "astrodienst_aspect",
        "astrodienst_sign_ruler",
        "astrodienst_house_ruler"
      ],
      "internal_refs": [],
      "gap_reason": null
    },
    "traditional": {
      "status": "SUPPORTED",
      "epistemic_scope": [
        "B_TECHNIQUE"
      ],
      "source_ids": [
        "paulus_alexandrinus_introductory_matters_ch23",
        "vettius_valens_anthology_lots",
        "firmicus_mathesis_2_29_antiscia"
      ],
      "internal_refs": [],
      "gap_reason": null
    },
    "modern_psychological": {
      "status": "SUPPORTED",
      "epistemic_scope": [
        "B_TECHNIQUE"
      ],
      "source_ids": [
        "arroyo_relationships_life_cycles_1993",
        "arroyo_astrology_karma_transformation_1992",
        "greene_relating_1978",
        "reinhart_chiron_healing_journey_2010"
      ],
      "internal_refs": [],
      "gap_reason": null
    },
    "evolutionary": {
      "status": "PARTIAL",
      "epistemic_scope": [
        "B_TECHNIQUE"
      ],
      "source_ids": [
        "arroyo_astrology_karma_transformation_1992"
      ],
      "internal_refs": [],
      "gap_reason": "El corpus actual contiene astrología orientada al crecimiento, pero no una fuente primaria/metodológica registrada de la escuela formal de Astrología Evolutiva."
    },
    "karmic": {
      "status": "PARTIAL",
      "epistemic_scope": [
        "B_TECHNIQUE",
        "C_DOCTRINE"
      ],
      "source_ids": [
        "arroyo_astrology_karma_transformation_1992",
        "steiner_karmic_relationships_1924"
      ],
      "internal_refs": [],
      "gap_reason": "La capa combina un método astrológico identificado con doctrina reencarnacionista; ambas clases deben permanecer separadas en autoría."
    },
    "draconic": {
      "status": "SUPPORTED",
      "epistemic_scope": [
        "B_TECHNIQUE"
      ],
      "source_ids": [
        "crane_draconic_astrology_1987",
        "blaquier_draconic_astrology_2017_2021"
      ],
      "internal_refs": [],
      "gap_reason": null
    },
    "esoteric": {
      "status": "SUPPORTED",
      "epistemic_scope": [
        "B_TECHNIQUE",
        "C_DOCTRINE"
      ],
      "source_ids": [
        "bailey_esoteric_astrology_1951",
        "bailey_esoteric_psychology_soul"
      ],
      "internal_refs": [],
      "gap_reason": null
    },
    "kabbalah": {
      "status": "PARTIAL",
      "epistemic_scope": [
        "C_DOCTRINE"
      ],
      "source_ids": [
        "zohar_lech_lecha_32_346_350",
        "vital_shaar_hagilgulim_1_soul_levels",
        "vital_shaar_hagilgulim_8_reasons_for_return",
        "vital_shaar_hagilgulim_20_zivug",
        "vital_shaar_hagilgulim_39_soul_roots",
        "vital_sefer_etz_chaim",
        "vital_pri_etz_chaim",
        "magid_life_of_soul_lurianic_gilgul",
        "fishbane_personal_identity_lurianic_gilgul_2024"
      ],
      "internal_refs": [],
      "gap_reason": "Estas fuentes sostienen hermenéutica cabalística del alma, gilgul, raíz y zivug; no constituyen por sí mismas un método validado de astrología cabalística natal."
    },
    "lots": {
      "status": "SUPPORTED",
      "epistemic_scope": [
        "B_TECHNIQUE"
      ],
      "source_ids": [
        "paulus_alexandrinus_introductory_matters_ch23",
        "vettius_valens_anthology_lots"
      ],
      "internal_refs": [],
      "gap_reason": null
    },
    "symmetry": {
      "status": "SUPPORTED",
      "epistemic_scope": [
        "B_TECHNIQUE"
      ],
      "source_ids": [
        "boehrer_declination_other_dimension",
        "firmicus_mathesis_2_29_antiscia"
      ],
      "internal_refs": [],
      "gap_reason": null
    },
    "fixed_stars": {
      "status": "SOURCE_GAP",
      "epistemic_scope": [
        "B_TECHNIQUE"
      ],
      "source_ids": [],
      "internal_refs": [],
      "gap_reason": "No existe todavía en source-registry una fuente metodológica preregistrada para estrellas fijas/parans en informes personales."
    },
    "asteroids": {
      "status": "SUPPORTED",
      "epistemic_scope": [
        "B_TECHNIQUE"
      ],
      "source_ids": [
        "george_bloch_asteroid_goddesses_2003",
        "lang_wescott_eros_basic_resources"
      ],
      "internal_refs": [],
      "gap_reason": null
    },
    "timing": {
      "status": "SUPPORTED",
      "epistemic_scope": [
        "B_TECHNIQUE"
      ],
      "source_ids": [
        "astrodienst_transit",
        "hand_planets_in_transit_2002"
      ],
      "internal_refs": [],
      "gap_reason": null
    },
    "publication": {
      "status": "SUPPORTED",
      "epistemic_scope": [],
      "source_ids": [],
      "internal_refs": [
        "reference/docx-publication.md",
        "reference/pdf-publication.md"
      ],
      "gap_reason": null
    }
  }
}
